{
  "documentType": "d2p:panel-mesh-result",
  "schemaVersion": "1.0.0",
  "meshResultId": "pmr_golden-drape-size-a-body-m-sleeve-left",
  "createdAt": "2026-01-09T00:00:00Z",
  "garmentRef": {
    "artifactId": "art_golden-tshirt-drape-garment-size-a",
    "revisionId": "rev_golden-tshirt-drape-garment-size-a-r1"
  },
  "panelInstanceId": "panel-sleeve-left",
  "pieceId": "sleeve",
  "cutInstanceKey": "sleeve-left",
  "evaluationRef": {
    "id": "pev_golden-tshirt-r1-size-a-regular-woven",
    "digest": "sha256:387f0d96525a8aa6cf143051b2b4d168811db52e6256f120fd4ea4c1c14cac7e"
  },
  "geometryDigest": "sha256:ac0f22fabde5d2155632e430ba4e019d15b06766fc3231838100c376f49dbd72",
  "meshProfile": {
    "id": "d2p:drape-coarse",
    "version": "1.0.0"
  },
  "backend": {
    "backendId": "conformance-kit-boundary-mesher",
    "backendVersion": "1.0.0",
    "adapterVersion": "1.0.0"
  },
  "status": "succeeded",
  "mesh": {
    "positions": [
      [
        -191.320363282,
        -0.932635402,
        0
      ],
      [
        187.668225,
        0.932635402,
        0
      ],
      [
        193.567654192,
        99.138438362,
        0
      ],
      [
        183.270195245,
        101.552050707,
        0
      ],
      [
        172.706202711,
        105.657122582,
        0
      ],
      [
        150.801300594,
        117.922135073,
        0
      ],
      [
        104.042614128,
        151.53506603,
        0
      ],
      [
        79.279564617,
        168.804945079,
        0
      ],
      [
        53.654534146,
        183.665073562,
        0
      ],
      [
        40.532953369,
        189.554287684,
        0
      ],
      [
        27.212890134,
        194.076431772,
        0
      ],
      [
        13.700015369,
        196.976628366,
        0
      ],
      [
        0,
        198,
        0
      ],
      [
        -13.265149616,
        196.979452259,
        0
      ],
      [
        -26.432074531,
        194.085031317,
        0
      ],
      [
        -39.49499682,
        189.567570595,
        0
      ],
      [
        -52.448138561,
        183.677903512,
        0
      ],
      [
        -78.001968703,
        168.78528395,
        0
      ],
      [
        -103.047341568,
        151.413839996,
        0
      ],
      [
        -151.427821909,
        117.261148371,
        0
      ],
      [
        -174.670482608,
        104.49323543,
        0
      ],
      [
        -186.034695357,
        100.06430415,
        0
      ],
      [
        -197.219792474,
        97.273167558,
        0
      ]
    ],
    "uvs": [
      [
        0.015096261,
        0
      ],
      [
        0.984903739,
        0.009376394
      ],
      [
        1,
        0.503040004
      ],
      [
        0.973649463,
        0.515172817
      ],
      [
        0.946616884,
        0.535808304
      ],
      [
        0.890563645,
        0.597462403
      ],
      [
        0.770911167,
        0.766428802
      ],
      [
        0.707544112,
        0.853241501
      ],
      [
        0.641971304,
        0.927940801
      ],
      [
        0.608394021,
        0.957544863
      ],
      [
        0.574308833,
        0.9802769
      ],
      [
        0.539730254,
        0.994855688
      ],
      [
        0.504672794,
        1
      ],
      [
        0.470728127,
        0.994869883
      ],
      [
        0.437034811,
        0.980320129
      ],
      [
        0.403607631,
        0.957611634
      ],
      [
        0.370461373,
        0.928005295
      ],
      [
        0.305070761,
        0.853142668
      ],
      [
        0.240981259,
        0.76581942
      ],
      [
        0.117178714,
        0.594139737
      ],
      [
        0.057702237,
        0.529957644
      ],
      [
        0.028621946,
        0.507694172
      ],
      [
        0,
        0.49366361
      ]
    ],
    "triangles": [
      [
        22,
        0,
        1
      ],
      [
        22,
        1,
        2
      ],
      [
        22,
        2,
        3
      ],
      [
        22,
        3,
        4
      ],
      [
        22,
        4,
        5
      ],
      [
        22,
        5,
        6
      ],
      [
        6,
        7,
        8
      ],
      [
        6,
        8,
        9
      ],
      [
        6,
        9,
        10
      ],
      [
        6,
        10,
        11
      ],
      [
        6,
        11,
        12
      ],
      [
        6,
        12,
        13
      ],
      [
        6,
        13,
        14
      ],
      [
        6,
        14,
        15
      ],
      [
        6,
        15,
        16
      ],
      [
        6,
        16,
        17
      ],
      [
        6,
        17,
        18
      ],
      [
        6,
        18,
        19
      ],
      [
        6,
        19,
        20
      ],
      [
        6,
        20,
        21
      ],
      [
        6,
        21,
        22
      ]
    ]
  },
  "vertexUvToPattern2D": {
    "kind": "affine",
    "matrix": [
      390.787446666,
      0,
      -197.219792474,
      0,
      198.932635402,
      -0.932635402
    ]
  },
  "edgeBindings": [
    {
      "edgeId": "sleeve-cap-back",
      "sampleCount": 11,
      "maxDeviationMm": 0.453902658
    },
    {
      "edgeId": "sleeve-cap-front",
      "sampleCount": 11,
      "maxDeviationMm": 0.488190152
    },
    {
      "edgeId": "sleeve-hem",
      "sampleCount": 2,
      "maxDeviationMm": 0
    },
    {
      "edgeId": "sleeve-underarm-back",
      "sampleCount": 2,
      "maxDeviationMm": 0
    },
    {
      "edgeId": "sleeve-underarm-front",
      "sampleCount": 2,
      "maxDeviationMm": 0
    }
  ],
  "maxApproximationErrorMm": 0.488190152,
  "diagnostics": [],
  "meshDigest": "sha256:f6ad3ed221424118ace002aa7c3d23a23ce73e02fe1fa2d748e5f0103d97c3b8",
  "resultDigest": "sha256:b1baf24801f2455fb7e5be6985591013b4697112116efd1fdd530f62b9db7666"
}
