{
  "documentType": "d2p:panel-mesh-result",
  "schemaVersion": "1.0.0",
  "meshResultId": "pmr_golden-drape-size-a-body-m-front",
  "createdAt": "2026-01-09T00:00:00Z",
  "garmentRef": {
    "artifactId": "art_golden-tshirt-drape-garment-size-a",
    "revisionId": "rev_golden-tshirt-drape-garment-size-a-r1"
  },
  "panelInstanceId": "panel-front",
  "pieceId": "front",
  "cutInstanceKey": "front",
  "evaluationRef": {
    "id": "pev_golden-tshirt-r1-size-a-regular-woven",
    "digest": "sha256:387f0d96525a8aa6cf143051b2b4d168811db52e6256f120fd4ea4c1c14cac7e"
  },
  "geometryDigest": "sha256:ac0f22fabde5d2155632e430ba4e019d15b06766fc3231838100c376f49dbd72",
  "meshProfile": {
    "id": "d2p:drape-coarse",
    "version": "1.0.0"
  },
  "backend": {
    "backendId": "conformance-kit-boundary-mesher",
    "backendVersion": "1.0.0",
    "adapterVersion": "1.0.0"
  },
  "status": "succeeded",
  "mesh": {
    "positions": [
      [
        -255,
        0,
        0
      ],
      [
        255,
        0,
        0
      ],
      [
        255,
        435,
        0
      ],
      [
        246.911010742,
        436.147460938,
        0
      ],
      [
        239.825585938,
        439.4921875,
        0
      ],
      [
        233.697290039,
        444.887695312,
        0
      ],
      [
        228.4796875,
        452.1875,
        0
      ],
      [
        224.126342773,
        461.245117188,
        0
      ],
      [
        220.590820312,
        471.9140625,
        0
      ],
      [
        215.7875,
        497.5,
        0
      ],
      [
        213.698242188,
        527.7734375,
        0
      ],
      [
        213.9515625,
        561.5625,
        0
      ],
      [
        216.175976562,
        597.6953125,
        0
      ],
      [
        220,
        635,
        0
      ],
      [
        71.666666667,
        680,
        0
      ],
      [
        70.056966146,
        658.3203125,
        0
      ],
      [
        65.5078125,
        639.53125,
        0
      ],
      [
        58.439127604,
        623.6328125,
        0
      ],
      [
        49.270833334,
        610.625,
        0
      ],
      [
        38.422851563,
        600.5078125,
        0
      ],
      [
        26.315104167,
        593.28125,
        0
      ],
      [
        13.367513021,
        588.9453125,
        0
      ],
      [
        0,
        587.5,
        0
      ],
      [
        -13.367513021,
        588.9453125,
        0
      ],
      [
        -26.315104167,
        593.28125,
        0
      ],
      [
        -38.422851563,
        600.5078125,
        0
      ],
      [
        -49.270833334,
        610.625,
        0
      ],
      [
        -58.439127604,
        623.6328125,
        0
      ],
      [
        -65.5078125,
        639.53125,
        0
      ],
      [
        -70.056966146,
        658.3203125,
        0
      ],
      [
        -71.666666667,
        680,
        0
      ],
      [
        -220,
        635,
        0
      ],
      [
        -216.175976562,
        597.6953125,
        0
      ],
      [
        -213.9515625,
        561.5625,
        0
      ],
      [
        -213.698242188,
        527.7734375,
        0
      ],
      [
        -215.7875,
        497.5,
        0
      ],
      [
        -220.590820312,
        471.9140625,
        0
      ],
      [
        -224.126342773,
        461.245117188,
        0
      ],
      [
        -228.4796875,
        452.1875,
        0
      ],
      [
        -233.697290039,
        444.887695312,
        0
      ],
      [
        -239.825585938,
        439.4921875,
        0
      ],
      [
        -246.911010742,
        436.147460938,
        0
      ],
      [
        -255,
        435,
        0
      ]
    ],
    "uvs": [
      [
        0,
        0
      ],
      [
        1,
        0
      ],
      [
        1,
        0.639705882
      ],
      [
        0.984139237,
        0.641393325
      ],
      [
        0.970246247,
        0.64631204
      ],
      [
        0.95822998,
        0.654246611
      ],
      [
        0.947999387,
        0.664981618
      ],
      [
        0.939463417,
        0.678301643
      ],
      [
        0.93253102,
        0.693991268
      ],
      [
        0.923112745,
        0.731617647
      ],
      [
        0.919016161,
        0.776137408
      ],
      [
        0.919512868,
        0.825827206
      ],
      [
        0.923874464,
        0.878963695
      ],
      [
        0.931372549,
        0.933823529
      ],
      [
        0.640522876,
        1
      ],
      [
        0.6373666,
        0.968118107
      ],
      [
        0.628446691,
        0.940487132
      ],
      [
        0.614586525,
        0.917107077
      ],
      [
        0.596609477,
        0.897977941
      ],
      [
        0.575338925,
        0.883099724
      ],
      [
        0.551598243,
        0.872472426
      ],
      [
        0.52621081,
        0.866096048
      ],
      [
        0.5,
        0.863970588
      ],
      [
        0.47378919,
        0.866096048
      ],
      [
        0.448401757,
        0.872472426
      ],
      [
        0.424661075,
        0.883099724
      ],
      [
        0.403390523,
        0.897977941
      ],
      [
        0.385413475,
        0.917107077
      ],
      [
        0.371553309,
        0.940487132
      ],
      [
        0.3626334,
        0.968118107
      ],
      [
        0.359477124,
        1
      ],
      [
        0.068627451,
        0.933823529
      ],
      [
        0.076125536,
        0.878963695
      ],
      [
        0.080487132,
        0.825827206
      ],
      [
        0.080983839,
        0.776137408
      ],
      [
        0.076887255,
        0.731617647
      ],
      [
        0.06746898,
        0.693991268
      ],
      [
        0.060536583,
        0.678301643
      ],
      [
        0.052000613,
        0.664981618
      ],
      [
        0.04177002,
        0.654246611
      ],
      [
        0.029753753,
        0.64631204
      ],
      [
        0.015860763,
        0.641393325
      ],
      [
        0,
        0.639705882
      ]
    ],
    "triangles": [
      [
        42,
        0,
        1
      ],
      [
        42,
        1,
        2
      ],
      [
        42,
        2,
        3
      ],
      [
        42,
        3,
        4
      ],
      [
        42,
        4,
        5
      ],
      [
        42,
        5,
        6
      ],
      [
        42,
        6,
        7
      ],
      [
        42,
        7,
        8
      ],
      [
        42,
        8,
        9
      ],
      [
        12,
        13,
        14
      ],
      [
        11,
        12,
        14
      ],
      [
        10,
        11,
        14
      ],
      [
        9,
        10,
        14
      ],
      [
        9,
        14,
        15
      ],
      [
        9,
        15,
        16
      ],
      [
        9,
        16,
        17
      ],
      [
        9,
        17,
        18
      ],
      [
        9,
        18,
        19
      ],
      [
        9,
        19,
        20
      ],
      [
        9,
        20,
        21
      ],
      [
        9,
        21,
        22
      ],
      [
        9,
        22,
        23
      ],
      [
        9,
        23,
        24
      ],
      [
        29,
        30,
        31
      ],
      [
        28,
        29,
        31
      ],
      [
        27,
        28,
        31
      ],
      [
        26,
        27,
        31
      ],
      [
        25,
        26,
        31
      ],
      [
        24,
        25,
        31
      ],
      [
        9,
        24,
        31
      ],
      [
        9,
        31,
        32
      ],
      [
        9,
        32,
        33
      ],
      [
        9,
        33,
        34
      ],
      [
        9,
        34,
        35
      ],
      [
        9,
        35,
        36
      ],
      [
        9,
        36,
        37
      ],
      [
        9,
        37,
        38
      ],
      [
        9,
        38,
        39
      ],
      [
        9,
        39,
        40
      ],
      [
        9,
        40,
        41
      ],
      [
        9,
        41,
        42
      ]
    ]
  },
  "vertexUvToPattern2D": {
    "kind": "affine",
    "matrix": [
      510,
      0,
      -255,
      0,
      680,
      0
    ]
  },
  "edgeBindings": [
    {
      "edgeId": "front-armhole-left",
      "sampleCount": 12,
      "maxDeviationMm": 0.47787711
    },
    {
      "edgeId": "front-armhole-right",
      "sampleCount": 12,
      "maxDeviationMm": 0.47787711
    },
    {
      "edgeId": "front-hem",
      "sampleCount": 2,
      "maxDeviationMm": 0
    },
    {
      "edgeId": "front-neckline",
      "sampleCount": 17,
      "maxDeviationMm": 0.419350759
    },
    {
      "edgeId": "front-shoulder-left",
      "sampleCount": 2,
      "maxDeviationMm": 0
    },
    {
      "edgeId": "front-shoulder-right",
      "sampleCount": 2,
      "maxDeviationMm": 0
    },
    {
      "edgeId": "front-side-left",
      "sampleCount": 2,
      "maxDeviationMm": 0
    },
    {
      "edgeId": "front-side-right",
      "sampleCount": 2,
      "maxDeviationMm": 0
    }
  ],
  "maxApproximationErrorMm": 0.47787711,
  "diagnostics": [],
  "meshDigest": "sha256:9d86e35804069a690e014f1572ff702ea50097756445300a9a4e6f8046b5ee63",
  "resultDigest": "sha256:f97b19f7a783b6ca9e07d02eeb6b3ad1b171210c352a1ccf6f46fa5156b12297"
}
