{
  "documentType": "d2p:panel-mesh-result",
  "schemaVersion": "1.0.0",
  "meshResultId": "pmr_golden-drape-size-b-body-m-sleeve-right",
  "createdAt": "2026-01-09T00:00:00Z",
  "garmentRef": {
    "artifactId": "art_golden-tshirt-drape-garment-size-b",
    "revisionId": "rev_golden-tshirt-drape-garment-size-b-r1"
  },
  "panelInstanceId": "panel-sleeve-right",
  "pieceId": "sleeve",
  "cutInstanceKey": "sleeve-right",
  "evaluationRef": {
    "id": "pev_golden-tshirt-r1-size-b-regular-woven",
    "digest": "sha256:06cd386f4acac03c692c8e73e6ae8660641409e10089e9f1f445e69d8438ac47"
  },
  "geometryDigest": "sha256:bba3a59358191aa25bcdd50bc26670a2bee23cef691289ca0968be77624b6c0b",
  "meshProfile": {
    "id": "d2p:drape-coarse",
    "version": "1.0.0"
  },
  "backend": {
    "backendId": "conformance-kit-boundary-mesher",
    "backendVersion": "1.0.0",
    "adapterVersion": "1.0.0"
  },
  "status": "succeeded",
  "mesh": {
    "positions": [
      [
        -207.987577648,
        -1.031780733,
        0
      ],
      [
        203.901828573,
        1.031780733,
        0
      ],
      [
        209.958648553,
        101.857614915,
        0
      ],
      [
        198.789217518,
        104.446540332,
        0
      ],
      [
        187.330683266,
        108.849784682,
        0
      ],
      [
        163.570909638,
        122.005668081,
        0
      ],
      [
        112.852773597,
        158.06007901,
        0
      ],
      [
        85.9928293,
        176.584358155,
        0
      ],
      [
        58.197912896,
        192.523854163,
        0
      ],
      [
        43.965217984,
        198.84083218,
        0
      ],
      [
        29.517233443,
        203.691442842,
        0
      ],
      [
        14.860110404,
        206.802295623,
        0
      ],
      [
        0,
        207.9,
        0
      ],
      [
        -14.396785046,
        206.804688286,
        0
      ],
      [
        -28.686965948,
        203.698225906,
        0
      ],
      [
        -42.864271875,
        198.849822004,
        0
      ],
      [
        -56.922431994,
        192.528685725,
        0
      ],
      [
        -84.656231484,
        176.545052612,
        0
      ],
      [
        -111.838197761,
        157.90099972,
        0
      ],
      [
        -138.418164169,
        138.750200204,
        0
      ],
      [
        -164.345964054,
        121.246327218,
        0
      ],
      [
        -189.571430759,
        107.543053915,
        0
      ],
      [
        -201.905112089,
        102.789665005,
        0
      ],
      [
        -214.044397628,
        99.794053449,
        0
      ]
    ],
    "uvs": [
      [
        0.01428485,
        0
      ],
      [
        0.98571515,
        0.009876724
      ],
      [
        1,
        0.4924545
      ],
      [
        0.973657192,
        0.504845748
      ],
      [
        0.946632541,
        0.525920782
      ],
      [
        0.890595741,
        0.588888145
      ],
      [
        0.770978355,
        0.761453615
      ],
      [
        0.707629885,
        0.85011547
      ],
      [
        0.642076308,
        0.926405903
      ],
      [
        0.608508873,
        0.956640547
      ],
      [
        0.574433682,
        0.979856788
      ],
      [
        0.539865244,
        0.994746111
      ],
      [
        0.504818066,
        1
      ],
      [
        0.470863628,
        0.994757563
      ],
      [
        0.437160613,
        0.979889253
      ],
      [
        0.403723811,
        0.956683574
      ],
      [
        0.370568011,
        0.926429028
      ],
      [
        0.305158577,
        0.849927343
      ],
      [
        0.241050626,
        0.760692222
      ],
      [
        0.178362477,
        0.669031683
      ],
      [
        0.117212445,
        0.585253749
      ],
      [
        0.057718847,
        0.51966644
      ],
      [
        0.028630185,
        0.496915526
      ],
      [
        0,
        0.482577776
      ]
    ],
    "triangles": [
      [
        23,
        0,
        1
      ],
      [
        23,
        1,
        2
      ],
      [
        23,
        2,
        3
      ],
      [
        23,
        3,
        4
      ],
      [
        23,
        4,
        5
      ],
      [
        23,
        5,
        6
      ],
      [
        6,
        7,
        8
      ],
      [
        6,
        8,
        9
      ],
      [
        6,
        9,
        10
      ],
      [
        6,
        10,
        11
      ],
      [
        6,
        11,
        12
      ],
      [
        6,
        12,
        13
      ],
      [
        6,
        13,
        14
      ],
      [
        6,
        14,
        15
      ],
      [
        6,
        15,
        16
      ],
      [
        6,
        16,
        17
      ],
      [
        6,
        17,
        18
      ],
      [
        6,
        18,
        19
      ],
      [
        6,
        19,
        20
      ],
      [
        6,
        20,
        21
      ],
      [
        6,
        21,
        22
      ],
      [
        6,
        22,
        23
      ]
    ]
  },
  "vertexUvToPattern2D": {
    "kind": "affine",
    "matrix": [
      424.003046181,
      0,
      -214.044397628,
      0,
      208.931780733,
      -1.031780733
    ]
  },
  "edgeBindings": [
    {
      "edgeId": "sleeve-cap-back",
      "sampleCount": 11,
      "maxDeviationMm": 0.48816013
    },
    {
      "edgeId": "sleeve-cap-front",
      "sampleCount": 12,
      "maxDeviationMm": 0.493065617
    },
    {
      "edgeId": "sleeve-hem",
      "sampleCount": 2,
      "maxDeviationMm": 0
    },
    {
      "edgeId": "sleeve-underarm-back",
      "sampleCount": 2,
      "maxDeviationMm": 0
    },
    {
      "edgeId": "sleeve-underarm-front",
      "sampleCount": 2,
      "maxDeviationMm": 0
    }
  ],
  "maxApproximationErrorMm": 0.493065617,
  "diagnostics": [],
  "meshDigest": "sha256:e56811660961dedb79386f58d0836cd0afd8a7f1897630b4a0432ad5d2f1c58d",
  "resultDigest": "sha256:85062ca99ad2707ce1f4c0fe19396a59026618c2069636edffb874e795501b20"
}
